{
  "type": "AGENT_REQUEST",
  "version": "0.1",
  "from": "npub1ds7azg0huz4lh84a7r49vhehmhkvsfgjds7azg0huz4lh84a7r49vhehmh",
  "to": "npub12qrswl7u4t7qkm2rf8p5r6sfydexy6ea2qrswl7u4t7qkm2rf8p5r6sfyd",
  "timestamp": 1712800100,
  "nonce": "req-nonce-4f3d2a1b8e",
  "payload": {
    "request_id": "req_20260417_001",
    "intent": "schedule.negotiate",
    "action": "schedule.write",
    "content": "木曜19時からShibuyaで飲みに行きませんか？",
    "original_language": "ja",
    "translated_content": "Would you like to grab drinks in Shibuya Thursday at 7 PM?",
    "proposed_event": {
      "title": "Drinks",
      "start": "2026-04-17T19:00:00+09:00",
      "end": "2026-04-17T21:00:00+09:00",
      "location": "Shibuya"
    }
  },
  "signature": "252735ceacd887f562ecaf804fbc3e94eeb4e055ee9002004bcb5ac22cbf8230e01aeebb040aa1f8b3c796d5a4cf4f043f2ef6ff05f6833217d7f29304d39584"
}
